{
  "schemaVersion": 1,
  "crashDigest": "f7fd163fc620b5a81754cf43fba0c61d056e66f5dc2ea69db88ba6a70a5bcfbc",
  "executionProfileDigest": "e9b7845643b4942f1255e2fa3fd736eb28e60b9c402d6bdf67577142f7e009e9",
  "terminalState": {
    "role": "terminal-state",
    "digest": "182c79c265ab5f542a7d417341fa55eec589976ede6587afbc716e017ce3cb1e"
  },
  "classification": "declared-object-language-crash"
}
