{"classification":"declared-object-language-crash","crashDigest":"73ef6763a5fa91a03b764b566b678753ef2dcc661f960ba24bb4cf57d0342d6a","executionProfileDigest":"e9b7845643b4942f1255e2fa3fd736eb28e60b9c402d6bdf67577142f7e009e9","schemaVersion":1,"terminalState":{"digest":"15718bdffdfc2caffd43b17b81776086322e6f1ff64a8034cb7c32deac58c30c","role":"terminal-state"}}